,title,content,date,link
39,輸入複方食品添加物應檢附產品成分報告及官方衛生證明,    為強化輸入複方食品添加物產品之管理，自104年12月10日起，依據食品安全衛生管理法(下稱食安法)第35條第4項之規定，食品業者輸入複方食品添加物(香料除外)，應檢附原產國之製造廠商或負責廠商出具之產品成分報告及輸出國之官方衛生證明，供各級主管機關查核。衛生福利部於104年12月28日發布解釋令，就應檢附之「產品成分報告」及「官方衛生證明」進行解釋，供業者遵循。    「產品成分報告」應載明個別原料名稱，如屬食品添加物者，其名稱應為食品添加物使用範圍及限量暨規格標準所定之品名，或中央主管機關公告之通用名稱。「官方衛生證明」係指由出產國出具產品之「合法製售工廠之證明」、出產國或負責廠商國出具「產品衛生證明」、「產品自由銷售證明」或相同性質之證明文件。食品業者輸入複方食品添加物時，應依前述規定檢附該2項報告及文件，始得輸入。如於國內查獲已輸入之複方食品添加物，輸入時未檢附該2項報告及文件，可依食安法第48條命其限期改正，屆期不改正者，處3萬元以上300萬元以下罰鍰。    針對複方食品添加物之管理，食藥署依食安法規定，已逐步落實包括訂定准用食品添加物品項、使用範圍、限量及規格標準，強制所有食品添加物產品辦理登錄，輸入食品添加物應辦理輸入查驗，食品添加物製造、加工、調配及輸入業者應建立追溯追蹤系統，及實施自主檢驗。今實施輸入複方食品添加物檢附「產品成分報告」，可於產品通關時掌握產品所含確切成分，另要求檢附「官方衛生證明」，可保障產品來源之衛生安全。,2015-12-28,https://www.fda.gov.tw/tc/newsContent.aspx?cid=4&id=19405
40,跨域協力打擊不法，確保食安，消費放心!,行政院食品安全會報依據食品安全衛生管理法於104年成立，至今已召開4次會議，透過跨部會、跨專家學者領域及民間相關團體的專業和協助，盤點食品安全衛生管理法相關辦法研訂情形、國內風險評估相關研究暨擬定我國風險評估管理架構與人才培育方向，監督協調食品工廠分廠分照管理、食品業食品相關廢棄物清除處理機制，推動食品三級品管制度、淨安專案，並建立中央食品安全危機事件應變指揮中心標準作業程序，落實執行食品安全聯合稽查，強化全國食品安全事務之協調、監督、推動及查緝，建立食品安全衛生之預警及稽核制度，持續增進國人的飲食安全，協助我國食品產業發展。為積極協調督導跨部會強化食品安全業務，整體提升政府食品安全管理功能，行政院食品安全辦公室自103年10月22日成立以來，發揮風險預警功能，成立聯合稽查及取締小組，多次查獲不法食品及藥品，精進源頭管理跨部會合作機制及推動食品雲，建全食品安全管理體系。 歷經多次食安事件，新修訂之食品安全衛生管法在行政院各層級部門機關跨域協力下，食品安全管理新制順利推動： 一、 食品業者登錄：已約有29萬食品業者登錄。二、 落實一級品管：已公告要求16類食品業者實施強制檢驗制度。三、 食品追溯追蹤：已公告要求19類食品業者建立追溯追蹤制度。四、 分廠分照：食品或食品添加物工廠未單獨設立者，應於105年6月10日前完成辦理單獨設立，不得於同一廠址及廠房同時從事非食品之製造、加工及調配。五、 食品標示：食品安全衛生管理法中大幅加強標示規定，透明食品之來源資訊，並提高違規罰鍰金額，透過加強稽查取締，以有效嚇阻違法。六、 食品添加物管理：除已有之使用範圍及限量暨規格標準、單方食品添加物強制查驗登記外，於103年推動食品添加物業者及產品全面強制登錄、製造輸入業者自主檢驗制度，104年推動追溯追蹤及第三方驗證制度，衛生機關亦加強邊境管理、工廠管理及產品監測，全面強化食品添加物管理。鑒於食品安全管理範疇廣泛，除涵蓋農場至餐桌之各環節，亦涉及非食品用途之飼料、工業、廢棄物等非法流入食品鏈之防範，需由各領域、部會同心戮力，從政策面、執行面等分層級協調與推動，以達落實全程化之管理。 ,2015-12-26,https://www.fda.gov.tw/tc/newsContent.aspx?cid=4&id=19411
41,104年度「藥品優良運銷規範(GDP)輔導性訪查表揚暨成果發表會」,衛生福利部食品藥物管理署(以下簡稱食藥署)於104年12月22日舉辦「藥品優良運銷規範(GDP)輔導性訪查表揚暨成果發表會」，由衛生福利部許銘能次長及食品藥物管理署姜郁美署長蒞臨會場致詞及頒獎，表揚29家今(104)年度配合藥品優良運銷規範輔導性訪查的績優廠商(詳附件獲獎廠商清單)，鼓勵國內藥品運銷相關業者致力於提升用藥品質與維護民眾健康。今年典禮以「藥安心，好運到」為主題，並邀請績優廠商上台分享推動實施經驗，以及歷年協助食藥署進行業者輔導之專家分享講評，鼓勵其他藥品運銷業者一起投入心力與資源，共同提升國人用藥品質。我國已於102年1月1日起領先日本、韓國正式成為PIC/S會員，並於103年12月31日全面完成實施PIC/S GMP。全球化趨勢下，藥品全球化市場日益活絡，近年來國際間對於藥品品質管理制度已逐漸從製造面延伸至運銷面，為強化藥品運銷鏈之管控，藥品GDP係健全藥品供應鏈品質管理的下一個重要施政方向，PIC/S組織於103年6月1日正式公告其藥品GDP規範，由此看出世界各國對於GDP規範協和化及其管理制度之重視，而我國今(104)年7月16日亦正式公告「西藥藥品優良製造規範(第三部：運銷)」，目標訂於107年12月31日前先完成國產藥品製造業者及藥品許可證持有者實施藥品GDP，並以階段性逐步全面實施藥品GDP，提升國內藥品運銷品質，以完善藥品管理制度，讓民眾用藥更放心、更安心。為發展我國藥品GDP管理制度與國際接軌，食藥署自100年起即以委託計畫逐步推動我國GDP管理制度，執行內容包含蒐集國外GDP相關規範與管理機制，舉行藥品GDP國際會議，並持續辦理藥品GDP相關業者說明會、主題論壇、技術研討會及GDP物流廠觀摩等教育訓練活動，另自101年起辦理包含藥廠、經銷商、代理商及運銷業者在內共計145家、290廠次之業者自願性輔導性訪查，明(105)年食藥署將仍持續辦理GDP輔導性訪查計畫，尚未接受輔導之業者可把握機會提出申請，由專家實地指導GDP之硬體、技術及管理要求。藉由實地訪查與業者交換意見，協助業者應用於實務作業，期許未來能更順利推動GDP制度上路。,2015-12-22,https://www.fda.gov.tw/tc/newsContent.aspx?cid=4&id=19385
42,年菜新食趣 料理零負擔,    年節將近，為鼓勵大家動手下廚做年菜，衛生福利部食品藥物管理署(下稱食藥署)選在過年前夕舉辦年菜記者會，特別邀請獲選104年度FDA優良廚師-施建瑋主廚及陳麒文主廚，針對2-4人小家庭量身訂製2種料理主題的年菜設計與示範，教大家如何輕鬆擺滿一桌子的幸福！      本次記者會現場分別展示施主廚及陳主廚精心設計之「蔬食料理」、「創意料理」共12道年菜，並選用當令食材，示範具有創意之「凝聚團圓-食在地什鄉菜」、「過年當紅分子料理炸子雞」2道年菜。此外，2位主廚更現身分享私房秘訣，從食材選購(食材溯源)、保藏及烹飪過程等，無不網羅，以確保在製作美味年菜之際，能讓民眾吃得安心，吃出健康，過好年。     食藥署亦彙整99年至104年年菜記者會共48道中西式經典年菜，歡迎大家至食藥署中華民國廚師證書資訊管理系統(http://chef.fda.gov.tw/tblu/main/ap/index.jsp)下載「年菜大廚在我家」年菜食譜，參考使用。,2015-12-18,https://www.fda.gov.tw/tc/newsContent.aspx?cid=4&id=19382
43,看得到、聽得到、讀得懂，非處方藥外盒及說明書改版換新裝,    食品藥物管理署(下稱:食藥署)今(104)年度進行「民眾用藥健康素養」調查發現，4成以上不仔細閱讀藥品外盒及藥袋資訊，3成以上民眾無法完整說出藥品的用途，高達約6成民眾說不出自己正在服用藥品的藥名。    為兼顧民眾用藥安全與閱讀習慣，食藥署已先參考醫藥先進國家規定，針對非處方藥的外盒及說明書(仿單)進行改版，使民眾更容易閱讀；在修訂說明書(仿單)內容，要求依照藥品資訊的重要程度，如:品名、用途(適應症)、注意事項、用法用量等於說明書(仿單)中呈現，為提高民眾閱讀便捷性，在藥品外包裝方面，要求外盒最大面積處應呈現藥品部分重要資訊，此次外盒規劃增加「不得使用族群」、「諮詢電話」等，更應用QR Code科技技術，協助視障或銀髮族群等視力不佳族群，透過手機掃描QR Code轉化語音閱讀，取得上述相關藥品重要資訊。    最新製藥產業年鑑數據顯示，台灣非處方藥2014年銷售總額高達80億，為確保民眾用藥安全，民眾使用前是否詳細閱讀仿單及充分取得相關資訊實為重要。過去非處方藥品中部分成分，懷孕或特殊病患不得使用的資訊僅刊載於仿單中，民眾需於購買後拆除原包裝始可獲得該等資訊，除不利判斷是否適合使用，更容易造成消費糾紛，藉由此次改版將有效解決此類問題。    食藥署提醒民眾「生病找醫師、用藥問藥師」，用藥前應先充分閱讀說明書(仿單)，並多利用住家附近的社區藥局，找一個信賴的社區藥局藥師當全家人的家庭藥師，讓藥師守護您用藥安全。,2015-12-16,https://www.fda.gov.tw/tc/newsContent.aspx?cid=4&id=19366
44,食品輸入業者登錄平台推動成果及管理運用情形,"食品藥物管理署(下稱食藥署)持續積極輔導我國食品業者落實登錄制度並舉辦相關說明會，截至104年12月1日止，完成辦理食品輸入業者登錄之業者共計10,227家，其中以台北市、新北市及高雄市為最多分別為3,453家、1,622家及1,615家；輸入產品類別以水產品類、咖啡及茶類為最多，分別為2,683家(16.6%)及1,270家(7.89%)。「食品輸入業者登錄」平台為食品衛生主管機關與業者間良好之溝通管道，104年食藥署透由該平台共已發布28筆訊息提醒食品輸入業者。食藥署進一步說明，自104年起，食藥署利用業已建置完成之「食品業者登錄平台」功能，針對所有業者，或特定業態、業別之業者，週知食藥署訊息，例如:重申我國衛生管理法規、週知新發布管制措施或針對不合格率較高之產品提醒該類輸入業者留意等。此一功能係食藥署與食品業者之良好聯繫平台，有效並快速傳達相關訊息，有效並快速傳達食品安全相關訊息，使輸入業者可即時獲得警訊資訊及管制措施資訊，此預警機制可以降低輸入食品之安全風險。依衛生福利部104年9月18日公告修正「應申請登錄始得營業之食品業者類別、規模及實施日期」之規定，具有工廠登記、商業登記或公司登記之食品輸入業者自104年12月31日起全面納入應辦理登錄之範圍，將來該類業者應辦理登錄始得申請食品輸入查驗。食藥署未來仍將繼續推動登錄制度，以確實掌握食品業者動態、共同就我國食品安全進行把關。",2015-12-09,https://www.fda.gov.tw/tc/newsContent.aspx?cid=4&id=19344
45,預告修正食品添加物碘化鉀及碘酸鉀標準，強化食品添加物管理,                            食品藥物管理署(以下簡稱食藥署)於本(7)日預告修正「食品添加物使用範圍及限量暨規格標準」，草案修正重點為營養添加劑碘化鉀及碘酸鉀之使用範圍及限量標準。該草案將進行為期60天之預告評論期，以蒐集各界意見。        食品添加物標準之訂定，均參閱動物安全性試驗資料、國際間相關法規標準與准用情形、各種食品添加物品項之理化特性、加工用途及其使用之必要性、使用食品之種類、範圍、加工製程及添加量等具體文獻資料，並考量國人飲食習慣及健康風險等情況，審慎評估後據以訂定，業者產製食品時如依使用限量規定合法添加食品添加物，尚不致造成消費者健康之危害。本次修正重點為營養添加劑碘化鉀及碘酸鉀之使用範圍及限量標準，修正碘化鉀及碘酸鉀用於食鹽之限量規定至以碘計為20-33 mg/kg，係考量國人碘營養狀況需求擬定，期能補充國人碘營養素之來源。        另，衛生機關對於市售食品之食品添加物持續進行監測，如發現有違反食品添加物使用範圍及限量暨規格標準之規定者，依違反食品安全衛生管理法第18條第1項規定，依同法第47條處新台幣3-300萬元罰鍰，以維護民眾飲食健康安心。,2015-12-07,https://www.fda.gov.tw/tc/newsContent.aspx?cid=4&id=19338
46,「吃藥不能防感冒」－全國學童用藥素養調查結果公布,食品藥物管理署(簡稱食藥署)與教育部長期致力合作推動校園正確用藥教育，今(104)年12月3日假國立臺灣師範大學圖書館國際會議廳舉辦「吃藥不能防感冒－全國學童用藥素養調查」記者會，同步公布全國學童用藥素養調查結果。本次調查分析後發現，5成學生認為綜合感冒藥可以預防感冒，近3成學生曾服用感冒藥而未依藥師或說明書指示劑量服用，也有2成同時服用兩種以上的綜合感冒藥。此外，也發現學童如在未遵照用藥指導、不看藥品說明書、自行停藥等不當用藥行為越多，越易有較多的購藥風險行為及較少的自我照顧行為。因此，食藥署本年以「吃藥不能防感冒」為主軸，宣導正確使用綜合感冒藥，讓民眾瞭解感冒藥只能緩解症狀，不能預防感冒；服用時需依照醫師、藥師給予的資訊用藥，6歲以下的幼童，不建議自行使用綜合感冒藥；不可自行同時併用其他感冒藥品，以免過量服用同類藥品；增加藥量感冒症狀也不會好得比較快，反而增加副作用的風險。食藥署長期推廣民眾正確用藥的觀念，要遵守正確使用綜合感冒藥五要五不原則，五要為「要知道、要問藥師、要告知、要看標示、要遵醫囑」，五不為「不過量、不併用、不輕忽、不飲酒、不亂買」，若有任何問題一定要「生病找醫師，用藥找藥師」，如附件1、2。全國有17縣市104所學校結盟社區藥局的藥師，採一校一藥師策略，積極推動正確用藥教育，也舉辦「我家藥健康」小故事/行動劇徵選活動，強化安全用藥認知，活動共計選出39件用藥小故事及27件行動劇影片，獲獎作品已建置在「正確用藥互動學習網」（網址：http://doh.gov.whatis.com.tw/），歡迎大家踴躍觀看(得獎名單如附件3)。,2015-12-03,https://www.fda.gov.tw/tc/newsContent.aspx?cid=4&id=19326
47,個人自用膠囊狀、錠狀食品免申請輸入食品查驗之數量新制，104年12月1日上路,"衛生福利部於104年11月5日公告訂定「輸入食品及相關產品符合免申請輸入查驗之條件與其適用之通關代碼」，及「輸入規定511項下食品得由海關逕予放行之條件及其通關代碼」。自104年12月1日起，個人自用非供販售之錠狀、膠囊狀食品，以郵包或貨運途徑輸入我國者，免向衛生福利部食品藥物管理署申請輸入食品查驗，並得由海關逕予放行之數量，由「每種產品總數不超過1,200粒」，調整為「每種數量不超過12瓶(盒、罐、包、袋)，合計以不超過36瓶(盒、罐、包、袋，以原包裝為限)」。詳細公告內容可於食品藥物管理署網站(http://www.fda.gov.tw/ 首頁 > 公告資訊 > 本署公告)查詢。食品藥物管理署強調，凡以前述個人自用豁免查驗方式輸入之產品，不得供為販售，如有販售行為，涉違反食品安全衛生管理法第30條第3項之規定，依同法第51條第2項，得處以停止其免查驗申請1年之處分。食品藥物管理署提醒民眾，均衡飲食、正常作息、適度運動是身體保健基本之道，如需補充保健或營養食品，可先請教醫師或營養師等專業醫事人員之意見，選擇最適合自己之食品，食用前看清楚產品標示之建議攝取量、警語及注意事項，食用後出現不適症狀，應立即停止食用並就醫，千萬不要誤信「排毒反應」。相關保健資訊，可至衛生福利部全國健康食品及膠囊錠狀食品非預期反應通報系統網站(http://hf.fda.gov.tw/TDRF_HUAS/Huas/Home.aspx)查詢。",2015-12-02,https://www.fda.gov.tw/tc/newsContent.aspx?cid=4&id=19316
48,生技醫藥法規科學週(Regulatory Science BIO Week) 精彩閉幕,食品藥物管理署(以下簡稱食藥署)舉辦為期5天的「生技醫藥法規科學週 (Regulatory Science BIO Week)」於今(20)日圓滿閉幕，本次會議聚焦「前瞻生物藥品法規科學」、「再生醫學科技、倫理與法規」及「細胞治療法規科學」三大領域深入交流，與會者包括美國、歐盟、日本、韓國、新加坡、大陸等法規官員、國際藥廠專家、國內產官學研各界代表等，共同分享創新生醫產品研發現況與法規進展，共吸引超過800人次聽眾與會。隨著生物技術逐漸嫻熟，全球醫藥先進國家不但對生物藥品、生物相似性藥品的發展與上市管理保持高度關注，更陸續健全各國法規。食藥署為增進國人用藥可近性及促進台灣生技醫藥產業的發展，致力於法規科學的提升，例如103年公告「生物技術/生物性藥品比較性試驗基準」、104年陸續修正「生物相似性藥品查驗登記基準」、公告「生物相似性單株抗體藥品查驗登記基準(草案)」、或實施「生物藥品許可證得同時刊載一家以上製造廠」規範等，期望加速新藥上市，達成「技術深耕台灣、產品外銷國際」之願景。 在全球人口高齡化時代，若細胞治療產品等突破性生技新藥的上市，預期能替傳統療法無法治癒之疾病，帶來一線希望。目前各國衛生主管機關陸續核准細胞治療產品進入市場，民眾對於細胞治療產品的接受度亦日益增加。我國細胞治療研究案正蓬勃發展，99年迄今已有23件細胞治療臨床試驗核准進行，領域涵蓋神經系統、皮膚與心血管適應症。為讓各界有所依循，食藥署逐步公告「人類細胞治療產品臨床試驗申請作業及審查基準」、「人類細胞治療產品查驗登記審查基準」、「人類細胞治療產品捐贈者合適性判定基準」，提供業界研發之參考依據，以利增加多元藥物新選擇，提升病人用藥安全及品質。 利用基因定序技術與生物資訊大數據的交叉比對，從而發展出新式醫學概念及醫療模式，精準醫學(precision medicine)理論的提出，推動了新興生物製劑與細胞治療產品的研發進程。量身訂做的個人化醫療不但預期能解決人口老化問題，更促進民眾健康的期許，故各國衛生機關陸續推動前瞻生物製劑及再生醫學產品政策。在國內產官學研的積極努力之下，新興藥品或生物製劑如雨後春筍般地出現，如何減少台灣與國際法規之差異，強化藥品上市後風險、品質等監控管理機制，乃是食藥署重要的課題。未來，食藥署將以高效率且具國際觀的視點，重新審視國內法規體制、提升國內法規科學；並同步與各界積極地對話討論，從而加速國內新藥開發及上市，持續為民眾用藥安全把關。,2015-11-20,https://www.fda.gov.tw/tc/newsContent.aspx?cid=4&id=19270
49,市售即食畜禽肉及蛋製品衛生狀況調查-微生物之抽樣檢驗結果,即食食品如因衛生管制措施不當，則可能導致食品中毒發生。食品藥物管理署(下稱食藥署) 104年度針對市售即食畜禽肉及蛋製品採樣179件進行衛生指標菌及病原菌檢驗，結果13件不合格(不合格率7.3%)。依「食品安全衛生管理法」，衛生指標菌超標者違反第17條之規定，依第48條經命其限期改正，屆期不改正者，處新臺幣3萬元以上300萬元以下罰鍰；病原菌不合格者違反第15條之規定，依第44條處新臺幣6萬元以上2億元以下罰鍰。食藥署針對市場流通率高的即食畜禽肉及蛋製品採樣檢驗，除調查其衛生指標菌，另針對其好發汙染病原菌：金黃色葡萄球菌、仙人掌桿菌、沙門氏桿菌、病原性大腸桿菌、單核球增多性李斯特菌等進行檢驗。抽樣之產品種類有滷煮燒烤類(76件)、火腿類(27件)、油炸類(26件)、肉乾類(22件)、其他肉製品(9件)及蛋製品(19件)總計179件；檢驗結果13件不符規定，包括衛生指標菌超標9件，檢出病原菌者1件，3件衛生指標菌超標且檢出病原菌。進一步分析則(1)不合格檢驗項目：以大腸桿菌群及大腸桿菌超標為主；(2)病原菌檢出：以病原性大腸桿菌檢出3件、仙人掌桿菌超標1件；(3)產品類別不合格率：滷煮燒烤類15.8%、蛋製品5.3%；(4)病原菌不合格率：滷煮燒烤類3.9%、蛋製品5.3%；(5)不合格產品之包裝型態均為散裝，且多販售於傳統市場及攤販。(6)火腿類、油炸類、肉乾類及其他肉製品則均符合衛生標準且未檢出病原菌。食藥署呼籲民眾在購買市售即食畜禽肉及蛋製品時，應挑選商譽良好、販售場所整潔衛生、人員衣著穿戴整潔、產品有適當防護的店家，另購買後應儘速食用完畢，否則應適當冷藏並於食用前充分復熱並注意是否有異味產生。這類產品微生物不符規定之原因可能為場所、設施及設備清潔不足、原材料受汙染或儲存不當、製備過程不當、人員衛生不良、盛裝容器不潔等所致。食藥署提醒業者應依法落實衛生自主管理，並可至食藥署網站下載「涼麵、熟食滷味、飲料及冰品之食品風險管控手冊」、「即食、熟食、飲料及冰品自主衛生管理之管控手冊」參考使用。,2015-11-19,https://www.fda.gov.tw/tc/newsContent.aspx?cid=4&id=19268
