,title,content,date,link
41,修正動物用藥殘留標準，加強食品殘留動物用藥管理,                        衛生福利部(下稱衛福部)於本(13)日修正「動物用藥殘留標準」，本次增修訂之布舍瑞林等4種動物用藥品，均為配合國內用藥需求訂定殘留容許量，期在保護國內消費者飲食安全之前提下，讓國內動物用藥之使用及管理更加合理化。本案於112年2月23日踐行預告程序60日，經充分蒐集考量評論意見，依原案辦理發布程序。    我國對於動物用藥之核准登記及訂定殘留容許量，分別由行政院農業委員會(下稱農委會)及衛福部依權責辦理，除參酌國際規範之外，另考量國內農牧漁業之需，依國人飲食習慣而訂定規範，以確保國人食用安全。    動物用藥殘留標準之訂定，係依據前端使用需求及規範，並根據藥品的動物毒理性資料、殘留試驗資料及國人飲食調查等資料，進行國人飲食所攝取殘留藥物之安全性評估及參酌國際規範後，送請「食品衛生安全與營養諮議會」審查，並會商農委會。另為履行透明化義務，依行政程序法及世界貿易組織「食品安全檢驗與動植物防疫檢疫措施協定」，辦理預告，廣徵各界意見後，訂定各類產品之殘留容許量。    另，衛福部食品藥物管理署持續監測市售畜禽水產品之動物用藥殘留，如發現有違反動物用藥殘留標準規定者，屬違反食品安全衛生管理法第15條第1項第5款規定，依同法第44條第1項第2款處新台幣6萬元以上2億元以下罰鍰，並由地方政府衛生局聯合農業機關追查供應來源及殘留原因，依法處辦，讓民眾食的安心。,2023-07-13,https://www.fda.gov.tw/tc/newsContent.aspx?cid=4&id=t601856
42,Fluticasone Furoate鼻噴劑之原廠在台專利將於今年11月底期滿，屆時學名藥即可上市,                        有關112年7月11日媒體報導過敏性鼻炎鼻噴劑藥品供應情形一事，食品藥物管理署(下稱食藥署)說明如下：一、「艾敏釋鼻用噴液懸浮劑」為含Fluticasone Furoate類固醇成分之鼻噴劑藥品，主要用於過敏性鼻炎，近期因全球供應鏈影響及國內需求增加而供不應求，目前控貨中，但仍持續輸入中。二、有關Fluticasone Furoate之學名藥，已有業者申請查驗登記且已審查完成，預計於原廠在台專利期滿後(專利到期日為112年11月27日），即可核發藥品許可證。三、類固醇鼻噴劑主要作用為免疫調節，以抑制鼻黏膜發炎，緩解呼吸道不適症狀，如鼻塞、流鼻水、打噴嚏。目前國內已核准多種其他類固醇成分且用於過敏性鼻炎之鼻噴劑，臨床顯示各種類固醇成分的鼻噴劑都有相當的治療效力，可供醫師處方替代使用，如Budesonide、Beclomethasone、Triamcinolone、 Mometasone等，且前述藥品國內合計有9張學名藥許可證，目前正常供應中。四、食藥署於112年4月29日已將艾敏釋鼻用噴液懸浮劑的替代藥品相關資訊公布至「西藥供應資訊平台」，並函請相關公協會及醫學會轉知會員，供臨床端參考。五、針對領有艾敏釋鼻用噴液懸浮劑藥品之慢性處方箋病人，食藥署已協調業者保留一定數量予中下游藥商並供應予藥局，以利病人就近領藥。    為強化我國西藥穩定供應，食藥署已建立「西藥供應資訊平台」(http://dsms.fda.gov.tw/)。倘醫療機構、藥局有缺藥情事，皆可至該平台查詢或通報。食藥署當接獲藥品短缺通報，會立即調查藥品供應狀態、協調廠商供應藥品予通報機構、評估替代藥品等，並將相關資訊公布於平台網站，供臨床端參考。                ,2023-07-12,https://www.fda.gov.tw/tc/newsContent.aspx?cid=4&id=t601852
43,洗淨加熱不生食，食品中毒不上門,                    　　依據102至111年之食品中毒案件統計資料指出，每年5至10月份為國內細菌性食品中毒發生之高峰期，食品藥物管理署（以下簡稱食藥署）提醒民眾，盡量不生食並澈底加熱食材，以避免食品中毒的發生。　　國人飲食習慣趨於國際化，經常食用生菜沙拉、生食海鮮（如生蠔、生魚片、鮭魚卵及涼拌生蝦等）、美乃滋（沙拉醬）、提拉米蘇及溏心蛋，甚至在熱騰騰的白飯上搭配一個生蛋黃等等，為了追求口感而忽略生食之風險。在潮濕炎熱的環境下，食品致病菌如腸炎弧菌、沙門氏桿菌等容易叢生，倘生食或未澈底加熱後食用，就可能發生食品中毒，而出現噁心、嘔吐、腹痛及腹瀉等症狀。　　此外，食藥署也提醒，不管是肉類、水產品或是即食蔬果，調理食用前均應澈底洗淨，可預防相關病原微生物的感染。烹調前後也應洗淨雙手，並將生、熟食使用不同器具分開處理，容器具於使用前後應保持清潔，避免交叉污染，且食材應充分加熱後再供食用。不論於何時何地供膳或用餐，都要遵守預防食品中毒之五要「洗鮮分熱存，要落實」及二不「山泉與動植，不採食」原則，在享受美食之餘，度過一個健康又安全的夏季!　　倘若發生疑似食品中毒事件時，應儘速就醫，並配合衛生單位調查，以釐清食品中毒發生原因。有關食品中毒之相關宣導品，已公布於本署網站之防治食品中毒專區內，歡迎民眾及各單位參考利用。（網址：http://www.fda.gov.tw/TC/site.aspx?sid=10936&r=594147036）,2023-07-12,https://www.fda.gov.tw/tc/newsContent.aspx?cid=4&id=t601851
44,西藥供應資訊平台112年6月14日至6月27日通報案件辦理情形,                        有關食品藥物管理署(以下簡稱食藥署)西藥供應資訊平台112年6月14日至6月27日公布之西藥短缺通報案件辦理情形，說明如下：一、西藥供應資訊平台自112年6月14日至6月27日共接獲32件藥品短缺通報案件，連同前次未辦結7件，合計39件。其中經調查無短缺案件11件、建議使用替代品項17件(共14項藥品)、無替代藥品啟動公開徵求案件1件、恢復供應品項4件、處理中案件數6件。二、針對Etomidate注射劑型供應情形，食藥署已採取相關因應作為，說明如下：(一)主要用於快速氣管插管 (Rapid Sequence Intubation; RSI) 之麻醉劑。(二)國內有一張藥品許可證，業者因臨床需求量增加導致短缺，目前控貨中(仍有約4-5個月庫存)，並預計113年2月底恢復供應。(三)食藥署已於112年6月20日啟動公開徵求，刻正徵求中，倘核准後，將公布相關資訊於西藥供應資訊平台。三、本署自接獲通報後，多數案件皆屬有替代品項之藥品，本署並將替代藥品資訊公布於平台，供醫療人員參考。另外倘無替代藥品，本署則啟動公開徵求專案進口或製造。    藥品短缺是全世界共同面臨的議題。為強化我國西藥穩定供應，食品藥物管理署(以下簡稱食藥署)已建立「西藥供應資訊平台」(http://dsms.fda.gov.tw/)。倘醫療機構、藥局有缺藥情事，皆可至該平台查詢或通報。食藥署當接獲藥品短缺通報，會立即調查藥品供應狀態、協調廠商供應藥品予通報機構、評估替代藥品等，並將相關資訊公布於平台網站，供臨床端參考。                ,2023-07-05,https://www.fda.gov.tw/tc/newsContent.aspx?cid=4&id=t601830
45,公告訂定「以基因改造啤酒酵母(Saccharomyces cerevisiae) EFSC4687菌株發酵生產之食品原料反式白藜蘆醇(trans-resveratrol)之使用限制及標示規定」,                    　　為有效合理管理非傳統性食品原料並確保消費者食用安全，衛生福利部(下稱衛福部)於112年6月29日公告訂定「以基因改造啤酒酵母(Saccharomyces cerevisiae) EFSC4687菌株發酵生產之食品原料反式白藜蘆醇(trans-resveratrol)之使用限制及標示規定」，並自發布日實施。　　本規定規範的反式白藜蘆醇，是利用基因改造啤酒酵母EFSC4687菌株發酵生產，並經過一系列的純化步驟製得，最終成品不含基改微生物與其轉殖基因片段。符合本規定所定加工製程及規格的反式白藜蘆醇，可使用於供成人使用的膳食補充品，每日食用限量為150毫克。另外，反式白藜蘆醇原料本身須標示相關生產來源資訊，而使用反式白藜蘆醇作為原料的食品，則應標示「本產品限供成人使用，孕婦及授乳者應避免食用；服用藥物者須諮詢醫師方可使用」的警語字樣。詳細訊息可至衛福部食品藥物管理署網站(http://www.fda.gov.tw)「公告資訊」項下的「本署公告」查詢。　　衛福部將持續把關並落實管理規範，規定正式施行後，經查獲食品所使用的原料不符合相關規定者，將依食品安全衛生管理法第47條及第48條規定，處新臺幣3萬元以上300萬元以下罰鍰，以維護民眾飲食健康安全。                ,2023-06-29,https://www.fda.gov.tw/tc/newsContent.aspx?cid=4&id=t601820
46,西藥供應資訊平台112年6月14日至6月20日通報案件辦理情形,                        有關食品藥物管理署(以下簡稱食藥署)西藥供應資訊平台112年6月14日至6月20日公布之西藥短缺通報案件辦理情形，說明如下：一、西藥供應資訊平台自112年6月14日至6月20日共接獲18件藥品短缺通報案件，連同前次未辦結7件，合計25件。其中經調查無短缺案件7件、建議使用替代品項9件(共7項藥品)、無替代藥品啟動公開徵求案件0件、恢復供應品項0件、處理中案件數9件。二、本署自接獲通報後，多數案件皆屬有替代品項之藥品，本署並將替代藥品資訊公布於平台，供醫療人員參考。另外倘無替代藥品，本署則啟動公開徵求專案進口或製造。    藥品短缺是全世界共同面臨的議題。為強化我國西藥穩定供應，食品藥物管理署(以下簡稱食藥署)已建立「西藥供應資訊平台」(http://dsms.fda.gov.tw/)。倘醫療機構、藥局有缺藥情事，皆可至該平台查詢或通報。食藥署當接獲藥品短缺通報，會立即調查藥品供應狀態、協調廠商供應藥品予通報機構、評估替代藥品等，並將相關資訊公布於平台網站，供臨床端參考。                ,2023-06-28,https://www.fda.gov.tw/tc/newsContent.aspx?cid=4&id=t601819
47,食藥署獲邀參加第59屆藥物資訊協會年會，舉辦主題論壇，展現臺灣臨床試驗實力並獲國際肯定,"                        第59屆藥物資訊協會年會 (The DIA 2023 Annual Meeting)於112年6月25日至6月29日在美國波士頓舉行，全球產、官、學、研界近萬人出席。臺灣由衛生福利部食品藥物管理署(以下簡稱食藥署)吳秀梅署長率食藥署及財團法人醫藥品查驗中心代表參與此一盛會。除設置主題攤位宣傳臺灣臨床試驗之充沛能量及試驗成果，亦獲邀舉行論壇，主題為「法規單位對於分散式臨床試驗(DCT)之觀點」，邀集美國FDA、歐盟EMA、瑞士Swissmedic及TransCelerate等各國醫藥法規單位及產業專家交流分散式臨床試驗的經驗以及國際發展趨勢，並向國際宣傳臺灣已準備好迎接新型態臨床試驗，與國際臨床試驗發展一同邁步向前。    本次食藥署除分享我國在分散式臨床試驗的經驗及未來展望，亦受邀發表壁報，分享我國在COVID-19疫苗審查研發及罕見疾病藥物(孤兒藥)法規判定之相關經驗，與各國交流藥品審查經驗，促進未來合作機會。    藥物資訊協會(Drug Information Association,簡稱DIA)為一世界性組織，由政府藥物法規主管機關、學術單位、生技醫藥研發公司、製藥公司、委託研究機構公司等會員組成。該協會每年辦理全球藥物研發與法規進展研討會議，不僅提供專業的藥物研發新知，會員亦能交流藥物研發經驗與藥政管理趨勢。    食藥署多次獲邀於藥品資訊協會年會分享藥政管理經驗，並在年會期間，與多國醫藥法規單位進行雙邊會談，是世界各國對臺灣藥政管理實力的肯定，也向世界展現臺灣臨床試驗充盈能量及國際競爭力。                ",2023-06-26,https://www.fda.gov.tw/tc/newsContent.aspx?cid=4&id=t601815
48,包裝食品過敏原，不漏看，安心吃,    為保障過敏體質消費者食的安心，衛生福利部(下稱衛福部)已要求包裝食品業者加強揭露食品過敏原標示訊息。包裝食品含有甲殼類、芒果、花生、牛奶羊奶、蛋、堅果類、芝麻、含麩質之穀物、大豆、魚類等10項及其製品，以及使用亞硫酸鹽類等終產品其二氧化硫殘留量每公斤10毫克以上者，均須在產品的容器或外包裝上顯著標示含有致過敏性內容物名稱之相關醒語資訊。    另外，針對烏賊等頭足類、田螺等螺貝類、葵花籽等種子類、奇異果等4項及其製品，衛福部也建議業者標示相關醒語資訊。如食品生產製程中未使用，但共用廠房、設備或生產管線有處理致生過敏之內容物，建議標示載明「本產品生產製程廠房，其設備或生產管線有處理○○」或等同意義字樣。     食品藥物管理署提醒有過敏體質的消費者，看清楚包裝上標示「本產品含有○○」、「本產品含有○○，不適合對其過敏體質者食用」或等同意義字樣，確保食用安心，健康不過敏。,2023-06-22,https://www.fda.gov.tw/tc/newsContent.aspx?cid=4&id=28867
49,西藥供應資訊平台112年5月31日至6月13日通報案件辦理情形,                        有關食品藥物管理署(以下簡稱食藥署)西藥供應資訊平台每2週定期公布西藥短缺通報案件辦理情形一事，說明如下：一、西藥供應資訊平台自112年5月31日至6月13日共接獲33件藥品短缺通報案件，連同前次未辦結6件，合計39件。其中經調查無短缺案件6件、建議使用替代品項22件(共19項藥品)、無替代藥品啟動公開徵求案件0件、恢復供應品項4件、處理中案件數7件。二、針對抗排斥用藥(Basiliximab注射劑型)供應情形，食藥署已採取相關因應作為，說明如下：(一)主要用於新的腎臟移植、預防急性器官排斥現象之發生等。(二)國內有一張藥品許可證，業者於112年5月底通報，因生產品質問題導致短缺，庫存預計可供應至112年7月底，並預計112年8月間恢復供應。(三)食藥署已於112年6月6日啟動公開徵求，於112年6月15日核准相同成分、劑型藥品專案輸入，廠商預計於112年7月底前輸入以補足缺口。三、本署自接獲通報後，多數案件皆屬有替代品項之藥品，本署並將替代藥品資訊公布於平台，供醫療人員參考。另外倘無替代藥品，本署則啟動公開徵求專案進口或製造。    藥品短缺是全世界共同面臨的議題。為強化我國西藥穩定供應，食品藥物管理署(以下簡稱食藥署)已建立「西藥供應資訊平台」(http://dsms.fda.gov.tw/)。倘醫療機構、藥局有缺藥情事，皆可至該平台查詢或通報。食藥署當接獲藥品短缺通報，會立即調查藥品供應狀態、協調廠商供應藥品予通報機構、評估替代藥品等，並將相關資訊公布於平台網站，供臨床端參考。                ,2023-06-21,https://www.fda.gov.tw/tc/newsContent.aspx?cid=4&id=t601812
50,發布修正農藥殘留容許量標準，加強食品殘留農藥管理,                        衛生福利部於本(15)日發布修正「農藥殘留容許量標準」及「動物產品中農藥殘留容許量標準」，修正內容為刪除滅紋等7種農藥14項殘留容許量，增修訂Benzovindiflupyr等10種農藥52項殘留容許量，增列液化澱粉芽孢桿菌CL3、肉桂醛、氯酸鈉為得免訂容許量之農藥，「鷹嘴豆(乾)」列屬乾豆類、「鷹嘴豆(鮮)」列屬豆菜類之規定，以及增修訂環克座等11種農藥於禽、畜產品之殘留容許量。    我國對於農藥之核准登記及修訂殘留容許量，分別由行政院農業委員會及衛生福利部依權責辦理。針對進口農產品，因其農作物生長環境、病蟲害防治及用藥方法與國內情形不同，為國民飲食需求，係由衛生福利部食品藥物管理署參酌先進國家作法，受理增修訂進口農產品殘留農藥容許量之申請。農藥殘留容許量之修正，經審核農藥之毒性資料、農作物殘留量消退試驗資料、核准登記使用方法等科學性資料，參酌國際間標準，評估國人對各類農作物取食總量之累積風險，並會商行政院農業委員會，經專家委員審核通過，期在保護國內消費者飲食安全之前提下，讓農藥之使用及管理更加合理化。    衛生福利部食品藥物管理署對於市售農產品之農藥殘留持續進行監測，如發現有違反農藥殘留容許量標準之規定者，依違反食品安全衛生管理法第15條第1項第5款規定，依同法第44條第1項第2款處新臺幣6萬元以上2億元以下罰鍰，並由地方政府衛生局聯合農業機關追查供應來源及殘留原因，依法處辦，讓民眾食的安心。,2023-06-15,https://www.fda.gov.tw/tc/newsContent.aspx?cid=4&id=t601793
51,管制藥品管理嚴謹 確保全民用藥安全,"                    食品藥物管理署(下稱食藥署)說明，管制藥品限供醫藥及科學上需用，否則即屬毒品，且醫藥使用須經醫師診療後方能憑其處方調劑供應。第三級、第四級管制藥品，若非醫藥及科學上需用，則屬第三級、第四級毒品，非法使用係屬違反毒品危害防制條例。依據管制藥品管理條例規定，領有管制藥品登記證者之業者及機構，應於業務處所設置簿冊，詳實登載管制藥品每日之收支、銷燬、減損及結存情形，並定期申報。西藥或動物用藥品製造業者及販賣業者，應依規定於每月二十日前就其前一個月簿冊登載情形申報;醫療機構、藥局、獸醫診療機構、畜牧獸醫機構及醫藥教育研究試驗機構，應依規定於每年一月向所在地衛生主管機關及食藥署辦理前一年管制藥品之申報。為強化管制藥品管理，食藥署及地方衛生局每年都有進行業者及機構之管制藥品實地稽核，以防止管制藥品流於非法使用。111年管制藥品實地稽核機構及業者計8,010家次，查獲226家次違規（違規比率2.82％），後續由地方衛生局行政裁處。歷年違規態樣皆以簿冊未落實每天結存與記載(如調劑或進貨時漏登記、登記購買來源錯誤等)、未依規定定期申報收支結存情形等行政疏失佔多數。查獲簿冊登載不正確者，涉違反管制藥品管理條例第28條第1項，可依同條例第39條處新臺幣6萬元以上30萬元以下罰鍰;查獲未依規定定期申報者，涉違反同條例第28條第2項，可依同條例第40條處新臺幣3萬元以上15萬元以下罰鍰。食藥署再次呼籲，領有管制藥品登記證者之業者及機構，應遵守管制藥品管理條例相關規定，管制藥品包括成癮性麻醉藥品及影響精神藥品(如安眠藥)，依管制藥品管理條例規定，限供醫藥及科學上之需用，如來源不明或非法使用，即涉及「毒品危害防制條例」所稱之毒品。                ",2023-06-14,https://www.fda.gov.tw/tc/newsContent.aspx?cid=4&id=t601791
52,食藥署持續強化資訊傳遞、主動監測及協調藥品妥善分配，確保藥品穩定供應,                        藥品短缺是全世界共同面臨的議題。為強化我國西藥穩定供應，食品藥物管理署(以下簡稱食藥署)已建立「西藥供應資訊平台」(http://dsms.fda.gov.tw/)。倘醫療機構、藥局有缺藥情事，皆可至平台網站上方搜尋框，填入個別藥品名稱、成分等關鍵字，查詢藥品是否有短缺及替代藥品資訊，亦可進行通報。食藥署當接獲藥品短缺通報，會立即調查藥品供應狀態、協調廠商供應藥品予通報機構、評估替代藥品等，並將相關資訊公布於平台網站，供臨床端參考。    西藥供應資訊平台自112年3月25日至112年6月5日，共計接獲253件藥品短缺通報案件，其中經調查無短缺案件84件、建議使用替代品項132件、恢復供應品項17件、處理中案件數8件，另無替代藥品啟動公開徵求案件共計4個品項(有12件通報)，其中肺癌用藥Entrectinib口服藥品、心律不整用藥Adenosine注射藥品及不活化A型肝炎疫苗皆已核准相同成分劑型替代藥品之專案進口，並已陸續輸入補足缺口；另抗排斥用藥Basiliximab注射劑型，亦已有業者申請專案進口。    為確保藥品穩定供應，食藥署已陸續採取相關精進作為：一、強化藥品供應資訊傳遞為利醫療機構及藥局於個別廠牌藥品短缺時，可購得替代藥品，食藥署除將相關資訊公布於「西藥供應資訊平台」，透過健保署VPN週知醫療機構及藥局、每週函請相關醫學會及公協會轉知會員等，並於112年3月中建立藥品供應資訊opendata，以利導入醫療機構醫令系統及藥局管理系統。二、主動監測藥品供應情形(一)食藥署持續因應國內外情勢，監控相關藥品庫存、生產及供應情形，協調業者增加生產與及早下訂原料藥，必要時協助業者加速相關藥品審查作業。(二)因應近期傳染疾病用藥需求增加，針對抗生素、呼吸道緩解藥品、腸胃藥品等，食藥署於2月13日及5月30日即函請業者增加生產及輸入，提早下訂原料藥、提高原料藥儲備，食藥署並主動調查相關藥品之庫存及供應情形，協助廠商加速相關審查作業，如自用原料藥申請、新增原料藥來源等，且協調產能仍有餘裕之業者，增加生產供應，並針對通報個別短缺藥品，提供替代藥品資訊，供臨床端參考。三、協調藥品妥善分配：針對短缺藥品，協調藥品許可證持有藥商妥善分配藥品予各層級醫療機構及藥局。後續將委託公協會執行藥品市場供應監測及調度相關計畫，以協助藥品於藥局間之分配及調度，減輕藥局藥品缺貨之情形。    藥事法於104年增訂第27-2條，以要求必要藥品許可證持有藥商，如有無法繼續製造、輸入或不足供應該藥品之虞時，應至少於6個月前向中央主管機關通報，以強化業者通報責任。    另，衛生福利部透過跨部門合作設立「藥品供應通報處理中心」，強化研擬防缺藥政策，例如推動國產學名藥政策，以提前預防藥品短缺；強化跨部門資料整合及主動監測，以早期發現缺藥事件；針對涉及跨司署之藥品短缺情事，透過跨部門合作處理，穩定我國藥品供應情形，確保民眾用藥權益。                ,2023-06-14,https://www.fda.gov.tw/tc/newsContent.aspx?cid=4&id=t601790
53,公告訂定「食品原料雞蛋白溶菌酶水解蛋白(Hen egg white lysozyme hydrolysate)之使用限制及標示規定」,                    　　為有效合理管理非傳統性食品原料並確保消費者食用安全，衛生福利部(下稱衛福部)於112年6月8日公告訂定「食品原料雞蛋白溶菌酶水解蛋白(Hen egg white lysozyme hydrolysate)之使用限制及標示規定」，並自發布日實施。　　本規定規範的雞蛋白溶菌酶水解蛋白，是以雞蛋白溶菌酶(Lysozyme)作為起始原料，經由取自地衣芽孢桿菌(Bacillus licheniformis)的枯草桿菌蛋白酶(subtilisin protease)進行水解後，再經過濾及乾燥等步驟製得的產品。符合本規定所定起始原料、加工製程及規格的雞蛋白溶菌酶水解蛋白，可使用於供成人使用的膳食補充品，每日食用限量為1公克。另外，使用雞蛋白溶菌酶水解蛋白作為原料的食品，應標示「本產品限供成人使用，對蛋過敏體質者、孕婦、授乳者及慢性腎臟病患應避免食用」的警語字樣。詳細訊息可至衛福部食品藥物管理署網站(http://www.fda.gov.tw)「公告資訊」項下的「本署公告」查詢。　　衛福部將持續把關並落實管理規範，規定正式施行後，經查獲食品所使用的原料不符合相關規定者，將依食品安全衛生管理法第47條及第48條規定，處新臺幣3萬元以上300萬元以下罰鍰，以維護民眾飲食健康安全。                ,2023-06-08,https://www.fda.gov.tw/tc/newsContent.aspx?cid=4&id=t601760
