,title,content,date,link
103,食藥署對於日本輸入食品應檢附之證明文件已訂定認定原則,食品藥物管理署(下稱食藥署)針對媒體報導「台灣不少業者抱怨，截至目前為止，食藥署根本無法提出何種證明才是認可文件，造成報驗困擾，業者憂心，政策上路將帶來巨大衝擊」一事，澄清說明如下： 食藥署對於應檢附證明之形式，已訂定證明文件認定原則，並制定「日本輸入食品應檢附產地證明文件及輻射檢測證明文件說明」資料。另，有關業者較常提出之疑問，該署已於食藥署網頁之日本食品管理工作專區(http://www.fda.gov.tw/TC/siteContent.aspx?sid=4490#.VVQhBkoVGUk)置有問答集，供各界瞭解，以協助業者報驗時，可順利配合政策施行。 一、    產地證明文件： (一)日本官方出具之產地(註明產地至都、道、府、縣)證明文件及其他可證明產地(註明產地至都、道、府、縣)之文件： 1.日本官方(中央或地方)產地證明 2.檢疫證明 3.自由銷售證明 4.衛生證明 (二)經日本官方（中央或地方）認可/授權/指定/委託機構所出具證明產地之文件，例如經濟產業省公布之日本商工會議所，核發之產地證明文件。 (三)非屬上兩者，經本署洽駐日單位後認定。 二、    輻射檢測證明文件 (一)日本官方（中央或地方）公布之輻射檢驗機構所核發。 (二)其他經日本官方或國際認證機關認證為執行輻射檢驗之機構所核發。 此兩公告係為保障國人食品消費安全之必要作為，且與國際上部分國家對日本食品輻射安全之管理模式相同。為維護我國消費者健康與權益，提供國人安全與安心之食品，應為政府及業者共同努力之目標。   附件1：日本輸入食品應檢附產地證明文件及輻射檢測證明文件說明 附件2-1：經濟產業省公布之日本商工會議所清單 附件2-2：東京商工會議所樣張 附件3：日本農林水產省公布指定之檢驗實驗室,2015-05-14,https://www.fda.gov.tw/tc/newsContent.aspx?cid=4&id=13514
104,澄清報載缺藥通報4年暴增近10倍及健保核價過低國際藥廠退出台灣市場,                    藥品供應鏈全球化，任一環節的變動牽動全球藥品供應的布局，而藥品短缺是全球共同面臨之議題，衛生福利部食品藥物管理署（簡稱:食藥署）相應此一全球趨勢於4年前建置缺藥通報窗口受理國內藥品短缺通報，自設置以來受理案件雖有增加之勢，然並非如報載國內缺藥通報4年暴增近10倍。且食藥署已就可能引起缺藥的品項做主動性評估，讓缺藥風險減至最低。食藥署自100年起與國內醫療院所及相關公協學會等攜手建置藥品短缺通報暨評估機制，由台灣臨床藥學會作為藥品短缺通報窗口，對可能產生缺藥的品項評估替代藥品、公告短缺訊息及徵求廠商製造輸入。該通報窗口係於100年11月設置，當年度“兩個月”僅有12件通報，101年通報47件，102年通報件數為84件及103年通報128件，102年及103年的案件增加係因食藥署為防缺藥於未然，開始進行主動選項委請缺藥通報中心進行評估，並加強宣導通報，是以通報件數的增加並非如外界所傳暴增10倍。另外亦藉由窗口的設置與主動性評估防範缺藥事件的發生，從而確保民眾用藥權益。綜合本月份辦理的「藥品短缺國際研討會」的各國報導，影響藥品短缺主要可從經濟及非經濟因素兩個面向來分析，經濟面向包括藥價、投資報酬效益及全球藥品供應鏈整併等，非經濟面向包括對藥品品質及藥廠設施管理要求提升等，在美國及歐盟等國家的缺藥分析中，注射劑是通報案件中最常見的劑型，係由於製造技術的複雜度及無菌品質要求較高所造成，而此一情形在我國亦然，故報載青黴素注射劑因健保核價過低憂國際藥廠退出台灣市場，係因101年4月國外原製造廠，因不符PIC/S GMP相關法規，導致暫時停止生產，該事件是屬於國際短缺情事，與健保核價無關。當時國內位因應該藥之短缺，食藥署與健保署已積極協調其他國外製藥廠，並專案進口其他同成分藥品，解決該藥品可能短缺之情事，目前供應正常。從我國通報窗口案例進一步分析，包括PIC/S GMP標準、健保藥價相關、藥品供需失衡、製造廠設施老舊及國際原料藥供應等因素皆是導致藥品短缺問題。食藥署對於通報事件處理原則如下：1.確認缺藥內容及原因，聯繫廠商估算庫存量。2.調查藥品用量及金額，估算藥品短缺時間及醫療健康體系影響時間。3.評估是否有替代藥品，如有，將資訊提供給醫療院所；如無，公開徵求製造廠或代理商製造或輸入。4.如接續時間有問題，以專案進口解決短暫性缺藥風險，協助醫院間之藥品調度，並加速申請案件審查。另健保署就臨床需求藥品無法供應之處理機制如下:1.健保署設立單一窗口，協助處理購藥問題，目前已將願意配合的藥商名單、聯絡窗口至於網站，供各界利用。2.倘不敷成本者健保署自97年7月23日起已有法定藥價調升處理機制廠商可建議提高藥價健保署亦以最速件處理。3.倘因缺藥須以專案進口或製造來解除缺藥危機，健保署亦配合優先核價並儘速生效。,2015-05-07,https://www.fda.gov.tw/tc/newsContent.aspx?cid=4&id=13469
105,澄清有關某些醫療機構反應狂犬病疫苗缺貨一事,                    有關某些醫療機構反應狂犬病疫苗缺貨一事，經查，近期衛生福利部食品藥物管理署(簡稱:食藥署)已同意狂犬病疫苗專案輸入計有兩萬餘支，預計可供應至今年年底，並無缺藥之虞。年初雖有醫院通報狂犬病疫苗短缺事件，惟在食藥署協調下並無缺藥之情事發生，緣起各家醫院額度不均，非缺藥之故。專案進口2萬餘支狂犬病疫苗足供國內使用至年底，請各醫療院所不要擔心供貨不足。為保障民眾用權益，食藥署對於缺藥通報事件處理原則如下。1.確認缺藥內容及原因，聯繫廠商估算庫存量。2.調查藥品用量及金額，估算藥品短缺時間及醫療健康體系影響時間。3.評估是否有替代藥品，如有，將資訊提供給醫療院所；如無，公開徵求製造廠或代理商製造或輸入。4.如接續時間有問題，以專案進口解決短暫性缺藥風險，協助醫院間之藥品調度，並加速申請案件審查。藥品短缺通報專線：(02)3393-7736分機15傳真通報：(02)3393-7750,2015-05-07,https://www.fda.gov.tw/tc/newsContent.aspx?cid=4&id=13468
106, 衛生福利部103年度市場監控63件嬰兒奶粉品質與衛生安全，合格率100%,    衛生福利部針對市面嬰兒奶粉產品進行衛生及品質監控，103年度共計完成63件嬰兒奶粉之衛生安全及營養標示符合性抽驗，檢驗項目包括營養標示符合性(總熱量、蛋白質、脂肪、飽和脂肪、碳水化合物及鈉)、衛生安全(生菌數、大腸桿菌群、阪崎腸桿菌)、農藥殘留及動物用藥殘留，檢驗結果合格率100%。    嬰兒奶粉是經特別調製用以滿足嬰兒與補充較大嬰兒生長發育營養需求之配方食品，其蛋白質來源之成分可為牛乳、羊乳、乳清蛋白、酪蛋白、黃豆蛋白等；脂肪來源之成分可為棕櫚油、葵花子油、椰子油、大豆油、魚油等；碳水化合物來源之成分可為乳糖、葡萄糖、蔗糖、麥芽糊精、馬鈴薯澱粉等。另外為符合嬰兒營養需求，添加維生素及礦物質等營養添加劑，產品之全成分完整配方是選擇嬰兒奶粉周延的考量重點。    一歲以下之嬰兒奶粉可能作為寶寶的唯一營養來源，故衛生福利部採取加強管理措施，除上市前產品應向衛生福利部查驗登記，確保嬰兒奶粉符合國際間及國內針對嬰兒營養需求及衛生標準之規定外，並強制規定業者須每季或每批選擇微生物或營養素對其產品進行自主管理檢驗。衛生福利部提醒您，母乳為嬰兒的最佳食品，對於部分婦女無法以母乳哺育或特殊醫療需求嬰兒，建議您諮詢醫師、營養師或醫護人員等專業人員意見，選擇合適的嬰兒奶粉及正確的食用方法。衛生福利部查驗登記許可之一歲以下嬰兒奶粉可於食品藥物消費者知識服務網(http://consumer.fda.gov.tw首頁 > 整合查詢中心 > 食品 > 核可資料查詢 > 嬰兒配方食品及較大嬰兒配方輔助食品許可資料)查詢。,2015-05-05,https://www.fda.gov.tw/tc/newsContent.aspx?cid=4&id=13456
107,溫馨小叮嚀 ~ 非即食生鮮芽菜務必充分清洗避免直接生食,基於健康、美容、塑身等目的，近年來生機飲食、蔬食沙拉等以蔬菜水果為生鮮原料製備之供食方式倍受民眾喜愛。此類產品常販售於便利商店、生鮮超市、大賣場、有機食品專賣店，民眾亦可自行採買生鮮原料製備，然而未經加熱處理或充分清洗之生鮮蔬果，如有病原微生物殘留，可能造成健康危害。 食品藥物管理署調查市售非即食之豌豆苗(嬰)、苜蓿芽、豆芽等生鮮芽菜類產品40件，結果39件檢出大腸桿菌群超過1100 MPN/g，5件檢出大腸桿菌菌數15~460 MPN/g，1件豌豆嬰、3件豌豆苗及2件苜蓿芽檢出金黃色葡萄球菌菌數3.6~240 MPN/g，其中自1件苜蓿芽及1件豌豆苗分離之金黃色葡萄球菌具有腸毒素產生能力。大腸桿菌及大腸桿菌群常被用來評量產品的衛生狀況，金黃色葡萄球菌則常見於人體皮膚表面。本調查結果，大腸桿菌群及大腸桿菌菌數偏高，且有金黃色葡萄球菌之存在，顯示產品可能於生產、包裝、運輸過程有被來自於環境或人體之微生物汙染，不宜生食，必須充分清洗後方能食用，否則恐將提高食品中毒發生之風險。 市售生鮮芽菜類商品，外包裝未標示可供即食者，應充分清洗後再行食用。如標示可供即食，則應符合本署公告「生食用食品類衛生標準」之要求。目前市售生鮮芽菜類產品大多包裝精美，型態多元，消費族群也有不斷增加的趨勢，但僅少數標示「須清洗後食用」，導致消費者有可能忽略清洗步驟而直接生食。由於芽菜類莖葉細小易藏污納垢，呼籲業者加強此類產品之衛生安全，建議加註「須清洗後食用」之標示以提醒民眾，並建議消費者食用前務必充分清洗或加熱後食用，防止食品中毒之發生。 ,2015-05-04,https://www.fda.gov.tw/tc/newsContent.aspx?cid=4&id=13452
108,食藥署盛大舉辦「APEC食品添加物管理及檢驗技術亞太研討會」,                          衛生福利部食品藥物管理署(TFDA)主辦之「亞太經合會(APEC)食品添加物管理及檢驗技術亞太研討會(APEC Conference on Management and Related Scientific Detection of Food Additives in Foods)」，於4月29日及30日在台北盛大舉行。本活動邀請美國、歐盟、日本、新加坡、香港及國內官方代表專家，就食品添加物相關議題進行演講，交流討論，並邀請衛生福利部林奏延次長親臨致詞。共計吸引國內外約300名產、官、學界嘉賓出席共襄盛舉。      近年來國內頻傳食品安全事件，發現其中有多起案例，涉及違法添加非准用於食品的化學添加物，不僅嚴重打擊食品消費環境，對經濟造成傷害，且可能影響民眾身體健康。為學習國際間對食品中違法添加非准用添加物之預警機制、監測系統、法規及檢驗技術等，TFDA特舉辦本活動，邀請國際專家分享寶貴實務經驗及成果，以有效提升我國食品添加物管理效能及檢驗技術。TFDA並成功爭取本研討會為APEC活動，促進國際交流。      本研討會邀請多位國際講師，以專題演講及案例分享之方式，傳達新穎、有效之新思維及作法，內容豐富多元，諸如：美國藥典食品標準資深聯絡官演講「打擊食品摻假－精進及挑戰」、歐盟衛生與食品安全事務代表演講「歐盟食品中非預期添加物之管理經驗」、日本東京都健康安全研究中心代表演講「日本食品中非預期添加物之監測檢驗作法及案例分享」、新加坡健康科學局代表演講「新加坡處理突發添加物及污染物事件之經驗分享」、香港食物環境衛生署食物安全中心及香港政府化驗所代表演講「香港食品中非預期添加物預警機制、監測及檢驗技術」。國內講師部分，邀請清華大學化學系凌永健教授演講「非預期性食品攙偽檢驗分析應用」，TFDA三位代表分別演講「食品中非預期添加物管理政策」、「處理非預期添加物造成之突發食安事件之經驗分享」及「非預期違法添加物之監測及發現」。講師及講題皆為一時之選，內容豐富實用。      藉由此研討會之舉辦，學習國際間新觀念及作法，截長補短，有助提升管理食品中違法添加非准用添加物之效能，替國人健康增添保障。                ,2015-04-29,https://www.fda.gov.tw/tc/newsContent.aspx?cid=4&id=13436
109,開啟雲端新時代，登錄資訊準又快！,去(103)年為食品業者登錄元年，截至104年4月21日，在各縣市衛生局的積極推動及食品業者支持下，全國已超過20萬家食品業者完成登錄！為我國食品安全之改革建立管理新頁，未來將可有效掌握食品業者資訊，提升安全管理效率。 衛生福利部自發布施行「食品業者登錄辦法」後，已陸續公告相關食品業者登錄始得營業，包括所有食品添加物相關業者，以及具工廠登記、商業登記或公司登記之食品製造、加工、輸入、販售業者及餐飲業者。自104年1月1日起，如未完成登錄作業且經要求限期改正、屆期未改正，將依「食品安全衛生管理法」處新台幣3萬元以上300萬元以下罰鍰。 分析現有食品業者登錄資料，台灣製造加工業則以烘焙炊蒸食品製造業(如麵包、蛋糕、西點、餅乾、糕粿糬類等)為大宗(18%)，雜項農產品加工食品及蔬果製品製造業佔第二(10%)，至於肉品製造業及冷凍冷藏肉類製造業等亦佔有8%。餐飲場所業態主要為餐廳(29%)，飲冰品業居次(17%)，第三為速食業(16%)；前三大業態之餐飲場所總和比例超過60%。進一步分析餐飲場所之型式，以加盟連鎖店居首(43%)，依序為無連鎖店(34%)及直營連鎖店(21%)。連鎖餐飲場所佔臺灣之餐飲場所比例超過50%。台灣輸入業者以輸入食品類別以加工產品類居首(12%)，食品添加物類及其他農產品類居次同為第二(各佔8%)，食用油脂類、咖啡及茶類及其他水產品類則皆為第三(各佔7%)。 而食品添加物登錄產品數量依序分別為香料、複方食品添加物、單方食品添加物；以用途功能別區分，產品數最多前三大類別是調味劑、品質改良劑及黏稠劑。 為精進食品製造業管理策略，食藥署將依據登錄平台資料，評估提供業者家數多之縣市較多行政資源，並針對特定業別業者加強輔導管理，以建構完整安全衛生飲食環境，讓民眾食在安心。食藥署已設置免付費諮詢專線(登錄制度諮詢：0800-588-106，系統操作諮詢：0809-080-209)，在食品業者登錄平台首頁(https://fadenbook.fda.gov.tw/)已建置使用手冊電子檔，詳細介紹各業別應填欄位及操作方式，方便業者下載參考，並依實際營業情形詳實填報，登錄完成後取得食品業者登錄字號。 各公私立機關可進入食品業者登錄平台首頁，查詢食品業者是否登錄及其登錄字號，以做為採購及訂定買賣契約之參考，支持配合政府政策之良善食品業者，建構台灣食品安全優質環境。 今(104)年食藥署將持續辦理業者說明會，並陸續提供食品業者登錄問與答、相關宣導訊息及說明課程資訊置於該署署網之「食品業者登錄專區」(http://www.fda.gov.tw/TC/siteList.aspx?sid=3867)，供食品業者及民眾參考，歡迎各位查閱。     食藥署也呼籲消費者，做為推動食品安全管理改革之尖兵，一起督促業者，為食品業者全登錄一起努力。,2015-04-24,https://www.fda.gov.tw/tc/newsContent.aspx?cid=4&id=13420
110,食藥署說明第二波專案清查碳酸鎂(鈣)原料之查核結果,衛生福利部食品藥物管理署(簡稱食藥署) 針對國內西藥廠之碳酸鎂(鈣)原料使用狀況，公布第二波全面清查結果，自104年4月13日至4月17日止共查核48家，有19家業者共23項產品不符規定(清單如附表)，主要涉及使用食品級或食品添加物許可證之碳酸鎂(鈣)作為主成分，皆已要求廠商將相關產品於4月22日午夜前下架，30日內完成回收(其中3家藥廠已主動回收涉案產品)，庫存品封存停止出貨；在賦形劑部分，廠商皆依藥典規格逐批抽樣檢驗合格後使用。 經食藥署查獲不符規定者，已立即要求業者將產品下架回收，並視違反節節，以違反藥事法第21條處新台幣6萬至30萬元罰鍰，或依違反藥事法第57條(嚴重違反GMP規定:限期改善、涉案產品停止生產，並處新台幣3萬至15萬元罰鍰)處置。 依據國際上作法，GMP查核係以風險考量進行抽樣與確認，若發現有違規疑義，再以系統性方式繼續追查是否有其他類似情形，若確認有違規情事，皆依法查處。碳酸鎂(鈣)原料屬多用途的非典型化學原料，在製藥、食品或工業等都廣泛使用，製藥主要用於胃藥中，食藥署過去查廠時，都是優先鎖定有療效、風險高的藥品原料進行抽查，可能較少關注這些傳統、風險低的非典型原料藥，對於此種多用途的非典型化學原料，食藥署後續將列入稽查重點項目。     此外，食藥署對於藥廠GMP稽查作業及後續處理流程，已建立符合國際規範之標準作業程序，所有作業與相關查廠人員皆嚴格遵循該規定執行，推動實施PIC/S GMP期間曾多次重申實施時程與標準不變之立場與決心，針對查核缺失，亦嚴格要求須完成改善始可通過評鑑。為保障消費者用藥安全，食藥署將持續秉持公平、公正及標準一致的要求，貫徹實施PIC/S GMP的政策。,2015-04-18,https://www.fda.gov.tw/tc/newsContent.aspx?cid=4&id=13384
111,食藥署說明第二波清查發現仍有一家藥廠曾使用允成公司碳酸鈣原料,衛生福利部食品藥物管理署近期清查第二波國內西藥廠之碳酸鎂(鈣)原料使用狀況，仍有1家藥廠(大豐製藥股份有限公司)曾於102年以前使用允成之碳酸鈣原料製造藥品(清單如附表)，已要求廠商立即下架，並於30日內完成回收。     本案除立即要求業者將涉案產品下架回收外，將以違反藥事法第21條第2款(新台幣6萬至30萬元罰鍰)及藥事法第57條(嚴重違反GMP規定:限期改善、涉案產品停止生產，並處新台幣3萬至15萬元罰鍰)處分。,2015-04-16,https://www.fda.gov.tw/tc/newsContent.aspx?cid=4&id=13379
112,食藥署重申PIC/S GMP查廠標準一致,有關網路新聞報導「黑心藥風波，3藥廠被爆關說衛福部官員」，食藥署對於藥廠GMP稽查作業及後續處理流程，已建立符合國際規範之標準作業程序，所有作業與相關查廠人員皆嚴格遵循該規定執行，並留有相關紀錄。現行PIC/S GMP符合性評鑑程序，係由廠商主動申請，經審核所送相關文件符合規定後，即安排實地查核，查核標準皆採國際PIC/S GMP一致性之標準，後續查核報告之發送與廠商改善報告審核等作業，皆採嚴謹之規範。評鑑過程中，廠商經常會詢問案件進度，食藥署在行政作業上皆儘速辦理，惟，針對查核缺失，仍嚴格要求須完成改善始可通過評鑑。PIC/S GMP的推動，是食藥署既定的政策，也是全民關心的議題，為避免影響民眾的用藥權益，推動過程食藥署長官亦會隨時掌握狀況，了解案件進度。推動PIC/S GMP期間，食藥署亦曾多次重申「時程不延長」、「標準不放鬆」、「報告不放水」之三不政策立場與決心，確保藥廠實施PIC/S GMP的一致性。為保障消費者用藥安全，食藥署將持續秉持公平、公正及標準一致的要求，貫徹實施PIC/S GMP的政策。,2015-04-15,https://www.fda.gov.tw/tc/newsContent.aspx?cid=4&id=13372
113,食藥署重申新措施絕無放寬日本輸入食品之管理,食品藥物管理署(下稱食藥署)針對媒體報導「5月中旬以後日本產品輸台，需檢附輻射檢驗及產地證明，新制寬鬆」一事，澄清說明如下： 目前我國對於日本輸臺食品仍持續採取嚴格管控措施，包含福島、群馬、壢木、茨城與千葉五縣產品仍暫停受理輸入查驗申請；對於五縣以外之產品，亦維持針對九大類產品(生鮮冷藏蔬果、冷凍蔬果、活生鮮冷藏水產品、冷凍水產品、乳製品、嬰幼兒食品、礦泉水或飲水、海草類及茶類製品)逐批查驗檢驗輻射值之措施。 為進一步強化管控日本輸臺食品，食藥署將於4月中旬正式公告，要求五縣以外，其他所有日本輸入食品皆應檢附日本官方或官方授權機關(構)之產地證明文件，或經食藥署認可之產地證明文件，產品始可輸臺。另外，依自100年迄今我國邊境查驗輻射檢測結果之科學證據，針對孩童及嬰幼兒日常攝食之食品，食藥署亦將公告要求特定區域之特定食品需檢附輻射檢測證明。 食藥署再次強調，五縣暫停受理報驗及九大類產品逐批查驗措施仍持續執行，將自本年度5月中旬起生效之新措施，是對日本食品更加嚴格管控。針對媒體報導新制寬鬆乙事，食藥署再次重申絕無措施放寬之情事。 ,2015-04-14,https://www.fda.gov.tw/tc/newsContent.aspx?cid=4&id=13367
114,日本輸入食品應檢附輻射檢測證明及產地證明文件,食品藥物管理署(下稱食藥署)已於104年4月13日將訂定「自日本輸入食品須檢附官方產地證明文件，始得申請輸入食品查驗」，及「自日本輸入之特定食品需檢附輻射檢測證明，始得申請輸入食品查驗」兩項公告，送請行政院公報編印中心辦理刊登公報，該措施將自正式公告後30日起生效。 食藥署說明，福島、群馬、壢木、茨城與千葉五縣產品仍暫停受理輸入查驗申請。產地證明需檢附以下文件之一:(1)日本官方出具之產地證明；(2)日本官方或其授權機構出具之可證明產地文件，或經本署認可之可證明產地文件；(3)其產地須載明至都、道、府、縣。依4年來邊境查驗輻射檢測結果之科學依據，及為保障嬰幼兒日常食用之乳製品、嬰幼兒食品、糖果、餅乾及穀類調製品等，於特定區域之特定食品需檢附輻射檢測證明。相關內容，仍以正式發布之公告為準。 前述兩公告正式生效實施前，日本輸入產品持續採取嚴格查核，查明輸入業者申報之輸入產品產地，此外，對於五縣以外產品，亦維持針對9大類產品(生鮮冷藏蔬果、冷凍蔬果、活生鮮冷藏水產品、冷凍水產品、乳製品、嬰幼兒食品、礦泉水或飲水、海草類及茶類製品)逐批查驗輻射之措施。 食藥署並強調，邊境受理食品輸入之查驗申請，審查核對文件資料，如發現輸入食品申報不實之行為，涉違反食品安全衛生管理法第30條第1項之規定，可依同法第47條第1款及第13款規定，處新臺幣3萬元以上300萬元以下罰鍰，惟若虛報產地，違法進口五縣暫停輸入之產品，係涉及違反同法第15條之規定，得依違反之相關規定處辦。         有關公告內容於發布後可至食藥署網站(www.fda.gov.tw)之「公告資訊」下之「本署公告」查詢。,2015-04-13,https://www.fda.gov.tw/tc/newsContent.aspx?cid=4&id=13360
